{"apiAttestation":{"algorithm":"Ed25519","keyId":"sha256:452a47f345fe57ae1d50b97ef105905fef642f7f0e6d408f2076b47ebbe80b26","signature":"mDl5NUE_Tkv98Iu4I1L4DICMC3q66H0n37GOgGZr0AaVrPooWMWeQUcA_ZP-HEXWOALOCTWXW7Nr6HnJQ0rJDg"},"leafAttestation":{"algorithm":"Ed25519","keyId":"sha256:23aba8e706af2e71bd740ff3bba305e50e447edb9b642c803b8ca6c309db8327","signature":"Zbzpw0vHwT1z_NZMn2UHjdYnJ-0GI68ff8ETFJOACN90Y_nfheRH-JGm9QpXDfpm8sGqQrSMhmldZ7mOeqU5Cg"},"receiptDigest":"sha256:2dbd97380f153dcbfd1ef6169f81a19555e054d959eee34a9c09d2565446dd60","receiptPayload":{"agreements":[{"accepted":true,"acceptedAt":"2026-09-04T16:30:14.822Z","actorId":"6ac48d16-1066-4719-9aff-a283765681a9","key":"accept-steam-agreement","revision":"official-current","url":"https://store.steampowered.com/subscriber_agreement/"}],"attemptId":"e396f488-76d2-4e7a-906e-b58c77cee695","baseRegistryDigest":"sha256:9d46054b4f33f9b6e6cb452d341e5b2f18d48834a318f8470b2d804c32aee403","checks":[{"code":"backup","completedAt":"2026-09-04T16:31:15.161Z","evidenceDigests":[],"startedAt":"2026-09-04T16:31:15.161Z","status":"not_applicable"},{"code":"restore","completedAt":"2026-09-04T16:31:15.162Z","evidenceDigests":[],"startedAt":"2026-09-04T16:31:15.162Z","status":"not_applicable"},{"code":"console","completedAt":"2026-09-04T16:31:15.163Z","evidenceDigests":[],"startedAt":"2026-09-04T16:31:15.163Z","status":"not_applicable"},{"code":"update","completedAt":"2026-09-04T16:31:15.163Z","evidenceDigests":[],"startedAt":"2026-09-04T16:31:15.163Z","status":"not_applicable"},{"code":"images-pinned","completedAt":"2026-09-04T16:30:46.504Z","evidenceDigests":[],"startedAt":"2026-09-04T16:30:46.501Z","status":"passed"},{"code":"healthy","completedAt":"2026-09-04T16:31:09.395Z","evidenceDigests":[],"startedAt":"2026-09-04T16:30:49.375Z","status":"passed"},{"code":"ports","completedAt":"2026-09-04T16:31:09.396Z","evidenceDigests":[],"startedAt":"2026-09-04T16:31:09.396Z","status":"passed"},{"code":"graceful-stop","completedAt":"2026-09-04T16:31:09.425Z","evidenceDigests":[],"startedAt":"2026-09-04T16:31:09.397Z","status":"passed"},{"code":"stopped-remains-stopped","completedAt":"2026-09-04T16:31:12.436Z","evidenceDigests":[],"startedAt":"2026-09-04T16:31:09.425Z","status":"passed"},{"code":"restart","completedAt":"2026-09-04T16:31:14.889Z","evidenceDigests":[],"startedAt":"2026-09-04T16:31:12.437Z","status":"passed"},{"code":"persistence","completedAt":"2026-09-04T16:31:14.890Z","evidenceDigests":[],"startedAt":"2026-09-04T16:31:14.890Z","status":"passed"},{"code":"cleanup","completedAt":"2026-09-04T16:31:15.164Z","evidenceDigests":[],"startedAt":"2026-09-04T16:31:14.891Z","status":"passed"}],"cleanup":{"completedAt":"2026-09-04T16:31:15.164Z","journalDigest":"sha256:b468d8deabdbde4f761270343eeb839e838ce9d04571a67f1e61cdd8ecab48c3","resources":{"backups":0,"containers":0,"directories":0,"networks":0,"ports":0,"secrets":0,"volumes":0},"status":"passed"},"completedAt":"2026-09-04T16:31:15.164Z","evidence":[],"expiresAt":"2026-12-03T16:31:15.164Z","policyVersion":"1.1.0","proofBundleDigest":"sha256:f007d60bea16e808ada68dc5694858d0933cd1ad94b2b595c47a915a98f1e38e","proofId":"77a7edb1-c704-4143-9e1d-3e6b75460cb7","proofPlanDigest":"sha256:6dda2f471fd5355468f698d414109035765fbf7cf5c3dcae7879b740c74c6976","result":"passed","revisionId":"38e7563d-8a15-4dd2-ad41-2d11abde4dae","runId":"2c86c760-92f9-434e-8750-5b52a1c572d5","runStatementDigest":"sha256:60fe60a3d6a308ba02beef14f95a9a183c23be4e59a64449e8e0facc2123cf4b","runner":{"agentVersion":"0.17.1","architecture":"amd64","leafId":"develop-proof-leaf","leafKeyId":"sha256:23aba8e706af2e71bd740ff3bba305e50e447edb9b642c803b8ca6c309db8327","operatingSystem":"linux","runtimeVersion":"9.0.15"},"seed":{"id":"vrising-pvp","intendedStableVersion":"1.0.0","manifestDigest":"sha256:da51a3ff00a732c4bd75d72f0adef7a7e0a055e0a01e3811eb3dcdc3055cee82","proofContractDigest":"sha256:5c1c5551264bb641faeb07d2e2d298f9ebe94539cd775f8f9a5bbede73a5b9ad","testedVersion":"1.0.0-rc.3"},"startedAt":"2026-09-04T16:30:46.500Z","validatorVersion":"0.14.0"},"schemaVersion":"dauva.dev/seed-proof/v2"}
