{"apiAttestation":{"algorithm":"Ed25519","keyId":"sha256:452a47f345fe57ae1d50b97ef105905fef642f7f0e6d408f2076b47ebbe80b26","signature":"Wven7hLBU-MhL99IxBoRm12BaxXG8iqlU6TX0C-Yv2woRFsCpKqAp4-QDfdHdvy5w9nJI4R8kwU6eXIeSaxtCQ"},"leafAttestation":{"algorithm":"Ed25519","keyId":"sha256:23aba8e706af2e71bd740ff3bba305e50e447edb9b642c803b8ca6c309db8327","signature":"6Iz2wa4Bh2HiX638bEbyBiyNfhmXMUlYD43WkH96Q9lWE4fvqb_ZRxHBw-cXnx2myFJk_HziUSvlATCEhI1HBw"},"receiptDigest":"sha256:b48be47131eb05935a538057d198b8000ddb729af9675705fb87a0db807fd096","receiptPayload":{"agreements":[{"accepted":true,"acceptedAt":"2026-09-04T16:30:10.732Z","actorId":"6ac48d16-1066-4719-9aff-a283765681a9","key":"accept-steam-agreement","revision":"official-current","url":"https://store.steampowered.com/subscriber_agreement/"}],"attemptId":"bdebbd0b-fc5b-4572-bd2d-9fd5c25dbfc4","baseRegistryDigest":"sha256:9d46054b4f33f9b6e6cb452d341e5b2f18d48834a318f8470b2d804c32aee403","checks":[{"code":"backup","completedAt":"2026-09-04T16:30:44.465Z","evidenceDigests":[],"startedAt":"2026-09-04T16:30:44.465Z","status":"not_applicable"},{"code":"restore","completedAt":"2026-09-04T16:30:44.466Z","evidenceDigests":[],"startedAt":"2026-09-04T16:30:44.466Z","status":"not_applicable"},{"code":"console","completedAt":"2026-09-04T16:30:44.467Z","evidenceDigests":[],"startedAt":"2026-09-04T16:30:44.467Z","status":"not_applicable"},{"code":"update","completedAt":"2026-09-04T16:30:44.467Z","evidenceDigests":[],"startedAt":"2026-09-04T16:30:44.467Z","status":"not_applicable"},{"code":"images-pinned","completedAt":"2026-09-04T16:30:13.253Z","evidenceDigests":[],"startedAt":"2026-09-04T16:30:13.246Z","status":"passed"},{"code":"healthy","completedAt":"2026-09-04T16:30:38.603Z","evidenceDigests":[],"startedAt":"2026-09-04T16:30:18.575Z","status":"passed"},{"code":"ports","completedAt":"2026-09-04T16:30:38.606Z","evidenceDigests":[],"startedAt":"2026-09-04T16:30:38.603Z","status":"passed"},{"code":"graceful-stop","completedAt":"2026-09-04T16:30:38.646Z","evidenceDigests":[],"startedAt":"2026-09-04T16:30:38.608Z","status":"passed"},{"code":"stopped-remains-stopped","completedAt":"2026-09-04T16:30:41.659Z","evidenceDigests":[],"startedAt":"2026-09-04T16:30:38.647Z","status":"passed"},{"code":"restart","completedAt":"2026-09-04T16:30:44.177Z","evidenceDigests":[],"startedAt":"2026-09-04T16:30:41.660Z","status":"passed"},{"code":"persistence","completedAt":"2026-09-04T16:30:44.181Z","evidenceDigests":[],"startedAt":"2026-09-04T16:30:44.178Z","status":"passed"},{"code":"cleanup","completedAt":"2026-09-04T16:30:44.476Z","evidenceDigests":[],"startedAt":"2026-09-04T16:30:44.185Z","status":"passed"}],"cleanup":{"completedAt":"2026-09-04T16:30:44.476Z","journalDigest":"sha256:36086e533313c0c4d453bac2b5bf0b4bad5c9d282e21721192543bc10923e4d3","resources":{"backups":0,"containers":0,"directories":0,"networks":0,"ports":0,"secrets":0,"volumes":0},"status":"passed"},"completedAt":"2026-09-04T16:30:44.476Z","evidence":[],"expiresAt":"2026-12-03T16:30:44.476Z","policyVersion":"1.1.0","proofBundleDigest":"sha256:a14c2ad5f9c86078aabf870248ce12a9f29d16188d0412e50d4de9b8393e89cc","proofId":"533ec5ff-6740-451e-a052-0b619a9f3f17","proofPlanDigest":"sha256:54a66e2bc5eea475b6f3e65144c22916f7728b06c5ae15b127c313fcac5687e7","result":"passed","revisionId":"38e7563d-8a15-4dd2-ad41-2d11abde4dae","runId":"abbc2af8-76e4-4723-9807-7497797d0e22","runStatementDigest":"sha256:6b0f7578571be44c1039551f420c2bc2446d7f4c0d8e614739e63fe34bac2e32","runner":{"agentVersion":"0.17.1","architecture":"amd64","leafId":"develop-proof-leaf","leafKeyId":"sha256:23aba8e706af2e71bd740ff3bba305e50e447edb9b642c803b8ca6c309db8327","operatingSystem":"linux","runtimeVersion":"9.0.15"},"seed":{"id":"vrising-pve","intendedStableVersion":"1.0.0","manifestDigest":"sha256:25146c53f35e8fc62c033cae69f8614b6669e6c84e6a13ba8d8f56aab9a4f65d","proofContractDigest":"sha256:46e42c7d9ab61f6d7a3e756175239ac02d78be58e23eba6c15779c1106386fc8","testedVersion":"1.0.0-rc.3"},"startedAt":"2026-09-04T16:30:13.194Z","validatorVersion":"0.14.0"},"schemaVersion":"dauva.dev/seed-proof/v2"}
